{
  "schema_version": "1.0.0",
  "review_date": "2026-09-28",
  "usage": "migration_and_acceptance_only",
  "source_sha256": "841c800b522390917f74abfc189a4d46edf9e22d8455ada87778a8495fcccf89",
  "workers": [
    {
      "legacy_worker_id": "TASK-AUTO-000001",
      "legacy_short_id": "A001",
      "legacy_name": "Gmail Intake",
      "business_capability": "Inbox mailroom: classify/file current Gmail.",
      "current_trigger": "completion-relative 30m.",
      "current_execution_class": "AI Agent",
      "2x_disposition": "MODIFY",
      "2x_execution_surface": [
        "ONLINE_SEMANTIC",
        "RESIDENT_DETERMINISTIC_PROVIDER"
      ],
      "2x_trigger": "gmail_delta_or_webhook_with_recovery_poll",
      "target_latency": "<1 minute",
      "semantic_required": "yes",
      "provider_adapter": [
        "gmail"
      ],
      "proposed_objects": [
        "provider_receipt",
        "communication",
        "semantic classification proposal",
        "Gmail command"
      ],
      "acceptance_test": "Duplicate receipt produces one disposition; provider success/DB failure reconciles by message ID/history. Shadow parity, then Production.",
      "retirement_maturity": "production_verified",
      "retirement_conditions": "Duplicate receipt produces one disposition; provider success/DB failure reconciles by message ID/history. Shadow parity, then Production.",
      "retired_at_review": false,
      "notes": "Gmail inbox + filing governance -> labels/read/archive disposition. Gmail provider; retries bounded batches and preserves blocked item IDs. | **MODIFY.** ONLINE_SEMANTIC with Gmail deterministic adapter; Gmail history/webhook or bounded delta event, recovery poll; <1m. | `provider_receipt`, `communication`, semantic classification proposal, Gmail command; Gmail adapter; semantic yes. Normalized stage surfaces/latencies are contract targets, not proof of implementation.",
      "source_row": [
        "A001 Gmail Intake",
        "Inbox mailroom: classify/file current Gmail. AI Agent; completion-relative 30m.",
        "Gmail inbox + filing governance -> labels/read/archive disposition. Gmail provider; retries bounded batches and preserves blocked item IDs.",
        "**MODIFY.** ONLINE_SEMANTIC with Gmail deterministic adapter; Gmail history/webhook or bounded delta event, recovery poll; <1m.",
        "`provider_receipt`, `communication`, semantic classification proposal, Gmail command; Gmail adapter; semantic yes.",
        "Duplicate receipt produces one disposition; provider success/DB failure reconciles by message ID/history. Shadow parity, then Production."
      ],
      "source_line": 16,
      "subordinate_preservation": []
    },
    {
      "legacy_worker_id": "TASK-AUTO-000002",
      "legacy_short_id": "A002",
      "legacy_name": "Drive Ingestion",
      "business_capability": "Quick Scan/intake identification, rename/move/register/link.",
      "current_trigger": "2h.",
      "current_execution_class": "AI Agent",
      "2x_disposition": "MODIFY",
      "2x_execution_surface": [
        "RESIDENT_DETERMINISTIC_PROVIDER",
        "ONLINE_SEMANTIC",
        "DATABASE_DETERMINISTIC"
      ],
      "2x_trigger": "drive_change_or_recovery_delta",
      "target_latency": "<1 minute",
      "semantic_required": "yes",
      "provider_adapter": [
        "google_drive"
      ],
      "proposed_objects": [
        "provider_receipt",
        "artifact_version",
        "ingestion item/stage"
      ],
      "acceptance_test": "Same Drive ID never ingested twice; isolated unreadable file does not block others; exact move/hash evidence. Shadow/Production.",
      "retirement_maturity": "production_verified",
      "retirement_conditions": "Same Drive ID never ingested twice; isolated unreadable file does not block others; exact move/hash evidence. Shadow/Production.",
      "retired_at_review": false,
      "notes": "Drive folder deltas/files -> artifacts, links, obligations, checkpoint. Drive; resumable boundary. | **MODIFY.** HYBRID: Drive adapter + ONLINE_SEMANTIC; Drive change event/recovery delta; <1m. | `provider_receipt`, `artifact_version`, ingestion item/stage; Drive adapter; semantic for classification/correlation. Normalized stage surfaces/latencies are contract targets, not proof of implementation.",
      "source_row": [
        "A002 Drive Ingestion",
        "Quick Scan/intake identification, rename/move/register/link. AI Agent; 2h.",
        "Drive folder deltas/files -> artifacts, links, obligations, checkpoint. Drive; resumable boundary.",
        "**MODIFY.** HYBRID: Drive adapter + ONLINE_SEMANTIC; Drive change event/recovery delta; <1m.",
        "`provider_receipt`, `artifact_version`, ingestion item/stage; Drive adapter; semantic for classification/correlation.",
        "Same Drive ID never ingested twice; isolated unreadable file does not block others; exact move/hash evidence. Shadow/Production."
      ],
      "source_line": 17,
      "subordinate_preservation": []
    },
    {
      "legacy_worker_id": "TASK-AUTO-000003",
      "legacy_short_id": "A003",
      "legacy_name": "Ingestion Verification",
      "business_capability": "Verify A001/A002 outcomes and standards.",
      "current_trigger": "2h.",
      "current_execution_class": "AI Agent",
      "2x_disposition": "ABSORB/MODIFY",
      "2x_execution_surface": [
        "DATABASE_DETERMINISTIC",
        "RESIDENT_DETERMINISTIC_PROVIDER",
        "ONLINE_SEMANTIC"
      ],
      "2x_trigger": "ingestion_commit_and_scheduled_audit",
      "target_latency": "transaction for invariants; audit SLA pending",
      "semantic_required": "conditional",
      "provider_adapter": [
        "gmail",
        "google_drive"
      ],
      "proposed_objects": [
        "assertion views",
        "integrity_finding",
        "provider reconciliation adapter"
      ],
      "acceptance_test": "Seed label/checkpoint mismatch and detect; healthy run needs no AI. Production before retirement.",
      "retirement_maturity": "production_verified",
      "retirement_conditions": "Seed label/checkpoint mismatch and detect; healthy run needs no AI. Production before retirement.",
      "retired_at_review": false,
      "notes": "recent runs/checkpoints/provider state -> discrepancy evidence. | **ABSORB/MODIFY.** DB constraints and flow assertions; provider sampling only where DB cannot prove; event after ingestion + scheduled audit. | assertion views, `integrity_finding`, provider reconciliation adapter; semantic only for classification quality samples. Normalized stage surfaces/latencies are contract targets, not proof of implementation.",
      "source_row": [
        "A003 Ingestion Verification",
        "Verify A001/A002 outcomes and standards. AI Agent; 2h.",
        "recent runs/checkpoints/provider state -> discrepancy evidence.",
        "**ABSORB/MODIFY.** DB constraints and flow assertions; provider sampling only where DB cannot prove; event after ingestion + scheduled audit.",
        "assertion views, `integrity_finding`, provider reconciliation adapter; semantic only for classification quality samples.",
        "Seed label/checkpoint mismatch and detect; healthy run needs no AI. Production before retirement."
      ],
      "source_line": 18,
      "subordinate_preservation": []
    },
    {
      "legacy_worker_id": "TASK-AUTO-000004",
      "legacy_short_id": "A004",
      "legacy_name": "Executive Briefing",
      "business_capability": "Twice-daily executive synthesis.",
      "current_trigger": "fixed 05:00/17:00.",
      "current_execution_class": "AI Agent",
      "2x_disposition": "KEEP/IMPROVE",
      "2x_execution_surface": [
        "ONLINE_SEMANTIC",
        "RESIDENT_DETERMINISTIC_PROVIDER"
      ],
      "2x_trigger": "scheduled_occurrence",
      "target_latency": "<5 minutes after due",
      "semantic_required": "yes",
      "provider_adapter": [
        "google_drive",
        "gmail",
        "twilio"
      ],
      "proposed_objects": [
        "briefing query contract",
        "artifact_version",
        "notification/delivery"
      ],
      "acceptance_test": "Reproduce required sections from frozen snapshot; stale/unknown sources explicit; no duplicate delivery. Production.",
      "retirement_maturity": "production_verified",
      "retirement_conditions": "Reproduce required sections from frozen snapshot; stale/unknown sources explicit; no duplicate delivery. Production.",
      "retired_at_review": false,
      "notes": "tasks/projects/calendar/financial facts -> versioned briefing artifact and governed delivery. | **KEEP/IMPROVE.** ONLINE_SEMANTIC; scheduled occurrence; <5m after due. | briefing query contract, `artifact_version`, notification/delivery; Docs/Drive adapter; semantic yes. Normalized stage surfaces/latencies are contract targets, not proof of implementation.",
      "source_row": [
        "A004 Executive Briefing",
        "Twice-daily executive synthesis. AI Agent; fixed 05:00/17:00.",
        "tasks/projects/calendar/financial facts -> versioned briefing artifact and governed delivery.",
        "**KEEP/IMPROVE.** ONLINE_SEMANTIC; scheduled occurrence; <5m after due.",
        "briefing query contract, `artifact_version`, notification/delivery; Docs/Drive adapter; semantic yes.",
        "Reproduce required sections from frozen snapshot; stale/unknown sources explicit; no duplicate delivery. Production."
      ],
      "source_line": 19,
      "subordinate_preservation": []
    },
    {
      "legacy_worker_id": "TASK-AUTO-000005",
      "legacy_short_id": "A005",
      "legacy_name": "Operational Backup",
      "business_capability": "Spreadsheet/Drive/Docs continuity backups.",
      "current_trigger": "Mon/Fri 08:00 and RUN NOW.",
      "current_execution_class": "AI Agent",
      "2x_disposition": "REPLACE",
      "2x_execution_surface": [
        "DATABASE_DETERMINISTIC",
        "RESIDENT_DETERMINISTIC_PROVIDER"
      ],